{
  "generado_at": "2026-06-25T06:29:37.736479726Z",
  "links": [
    {
      "confidence": 0.20000000298023224,
      "first_seen": "2026-06-25T06:29:37.653841Z",
      "kind": "estructura",
      "last_seen": "2026-06-25T06:29:37.653841Z",
      "rel": "DIRIGIÓ",
      "s": "luis-alberto-rodriguez-lopez-calleja",
      "sources": [],
      "status": "estructura",
      "t": "ania-lastre-morera"
    },
    {
      "confidence": 0.20000000298023224,
      "first_seen": "2026-06-25T06:29:37.578322Z",
      "kind": "estructura",
      "last_seen": "2026-06-25T06:29:37.578322Z",
      "rel": "VÍNCULO_FAMILIAR",
      "s": "raul-guillermo-rodriguez-castro",
      "sources": [],
      "status": "estructura",
      "t": "ania-lastre-morera"
    },
    {
      "confidence": 0.4000000059604645,
      "first_seen": "2026-06-25T06:25:53.238217Z",
      "kind": "presunto",
      "last_seen": "2026-06-25T06:29:37.537235Z",
      "rel": "FACILITA_FONDOS_A",
      "s": "fincimex",
      "sources": [],
      "status": "presunto",
      "t": "gran-azul-llc"
    },
    {
      "confidence": 0.550000011920929,
      "first_seen": "2026-06-24T19:29:45.583256Z",
      "kind": "estructura",
      "last_seen": "2026-06-25T06:29:37.500192Z",
      "rel": "CONTROLA",
      "s": "gaesa",
      "sources": [],
      "status": "estructura",
      "t": "fincimex"
    },
    {
      "confidence": 0.4000000059604645,
      "first_seen": "2026-06-25T06:29:37.423615Z",
      "kind": "presunto",
      "last_seen": "2026-06-25T06:29:37.423615Z",
      "rel": "RECIBE_FONDOS_DE_REMESAS_SUPERVISADAS_POR",
      "s": "gran-azul-llc",
      "sources": [],
      "status": "presunto",
      "t": "gaesa"
    },
    {
      "confidence": 0.4000000059604645,
      "first_seen": "2026-06-25T06:29:37.347977Z",
      "kind": "presunto",
      "last_seen": "2026-06-25T06:29:37.347977Z",
      "rel": "VINCULADA_A_ENTORNO_DE",
      "s": "gran-azul-llc",
      "sources": [],
      "status": "presunto",
      "t": "raul-guillermo-rodriguez-castro"
    },
    {
      "confidence": 0.4000000059604645,
      "first_seen": "2026-06-24T19:29:43.884372Z",
      "kind": "estructura",
      "last_seen": "2026-06-25T06:29:37.275946Z",
      "rel": "DIRIGIÓ",
      "s": "luis-alberto-rodriguez-lopez-calleja",
      "sources": [],
      "status": "estructura",
      "t": "gaesa"
    },
    {
      "confidence": 0.20000000298023224,
      "first_seen": "2026-06-25T06:29:37.197812Z",
      "kind": "estructura",
      "last_seen": "2026-06-25T06:29:37.197812Z",
      "rel": "VÍNCULO_FAMILIAR",
      "s": "raul-guillermo-rodriguez-castro",
      "sources": [],
      "status": "estructura",
      "t": "luis-alberto-rodriguez-lopez-calleja"
    },
    {
      "confidence": 0.20000000298023224,
      "first_seen": "2026-06-25T06:29:37.125178Z",
      "kind": "estructura",
      "last_seen": "2026-06-25T06:29:37.125178Z",
      "rel": "INFLUENCIA_FUERTE",
      "s": "raul-guillermo-rodriguez-castro",
      "sources": [],
      "status": "estructura",
      "t": "gaesa"
    },
    {
      "confidence": 0.20000000298023224,
      "first_seen": "2026-06-25T06:29:37.043005Z",
      "kind": "estructura",
      "last_seen": "2026-06-25T06:29:37.043005Z",
      "rel": "VÍNCULO_FAMILIAR",
      "s": "raul-guillermo-rodriguez-castro",
      "sources": [],
      "status": "estructura",
      "t": "raul-castro"
    },
    {
      "confidence": 0.20000000298023224,
      "first_seen": "2026-06-25T06:29:36.879413Z",
      "kind": "estructura",
      "last_seen": "2026-06-25T06:29:36.879413Z",
      "rel": "DIRIGE",
      "s": "pcc",
      "sources": [],
      "status": "estructura",
      "t": "miguel-diaz-canel"
    },
    {
      "confidence": 0.20000000298023224,
      "first_seen": "2026-06-25T06:29:36.765620Z",
      "kind": "estructura",
      "last_seen": "2026-06-25T06:29:36.765620Z",
      "rel": "DIRIGE",
      "s": "pcc",
      "sources": [],
      "status": "estructura",
      "t": "gobierno-cubano"
    },
    {
      "confidence": 0.4000000059604645,
      "first_seen": "2026-06-25T06:25:52.731374Z",
      "kind": "estructura",
      "last_seen": "2026-06-25T06:29:36.698549Z",
      "rel": "MIEMBRO_COMITE_CENTRAL",
      "s": "ania-lastre-morera",
      "sources": [],
      "status": "estructura",
      "t": "pcc"
    },
    {
      "confidence": 0.4000000059604645,
      "first_seen": "2026-06-25T06:25:52.644592Z",
      "kind": "estructura",
      "last_seen": "2026-06-25T06:29:36.571728Z",
      "rel": "PRESIDENTA_EJECUTIVA",
      "s": "ania-lastre-morera",
      "sources": [],
      "status": "estructura",
      "t": "gaesa"
    },
    {
      "confidence": 0.20000000298023224,
      "first_seen": "2026-06-25T06:29:36.440274Z",
      "kind": "estructura",
      "last_seen": "2026-06-25T06:29:36.440274Z",
      "rel": "SUBORDINADO_A",
      "s": "minfar",
      "sources": [],
      "status": "estructura",
      "t": "pcc"
    },
    {
      "confidence": 0.20000000298023224,
      "first_seen": "2026-06-25T06:29:36.293941Z",
      "kind": "estructura",
      "last_seen": "2026-06-25T06:29:36.293941Z",
      "rel": "RINDE_CUENTAS_A",
      "s": "gaesa",
      "sources": [],
      "status": "estructura",
      "t": "minfar"
    },
    {
      "confidence": 0.20000000298023224,
      "first_seen": "2026-06-25T06:29:35.992683Z",
      "kind": "estructura",
      "last_seen": "2026-06-25T06:29:35.992683Z",
      "rel": "CONTROLA_A_TRAVES_DE_CARGO",
      "s": "miguel-diaz-canel",
      "sources": [],
      "status": "estructura",
      "t": "minint"
    },
    {
      "confidence": 0.20000000298023224,
      "first_seen": "2026-06-25T06:29:35.837913Z",
      "kind": "estructura",
      "last_seen": "2026-06-25T06:29:35.837913Z",
      "rel": "EJERCE_CONTROL_DIRECTO",
      "s": "pcc",
      "sources": [],
      "status": "estructura",
      "t": "minint"
    },
    {
      "confidence": 0.800000011920929,
      "first_seen": "2026-06-25T06:29:35.763106Z",
      "kind": "confirmado",
      "last_seen": "2026-06-25T06:29:35.763106Z",
      "rel": "INSTRUYE",
      "s": "ania-lastre-morera",
      "sources": [],
      "status": "confirmado",
      "t": "adys-lastre-morera"
    },
    {
      "confidence": 0.800000011920929,
      "first_seen": "2026-06-25T06:29:35.683836Z",
      "kind": "confirmado",
      "last_seen": "2026-06-25T06:29:35.683836Z",
      "rel": "DIRIGE_OPERATIVAMENTE",
      "s": "adys-lastre-morera",
      "sources": [],
      "status": "confirmado",
      "t": "santa-lena-investment-lc"
    },
    {
      "confidence": 0.800000011920929,
      "first_seen": "2026-06-25T06:29:35.612972Z",
      "kind": "confirmado",
      "last_seen": "2026-06-25T06:29:35.612972Z",
      "rel": "DIRIGE_OPERATIVAMENTE",
      "s": "adys-lastre-morera",
      "sources": [],
      "status": "confirmado",
      "t": "remas-remas-investment-llc"
    },
    {
      "confidence": 0.4000000059604645,
      "first_seen": "2026-06-24T19:29:45.268959Z",
      "kind": "confirmado",
      "last_seen": "2026-06-25T06:29:35.539296Z",
      "rel": "RECIBE_CAPITAL_DESVIADO_DE",
      "s": "santa-lena-investment-lc",
      "sources": [],
      "status": "confirmado",
      "t": "gaesa"
    },
    {
      "confidence": 0.4000000059604645,
      "first_seen": "2026-06-24T19:29:45.195937Z",
      "kind": "confirmado",
      "last_seen": "2026-06-25T06:29:35.466895Z",
      "rel": "RECIBE_CAPITAL_DESVIADO_DE",
      "s": "remas-remas-investment-llc",
      "sources": [],
      "status": "confirmado",
      "t": "gaesa"
    },
    {
      "confidence": 0.20000000298023224,
      "first_seen": "2026-06-25T06:29:35.388844Z",
      "kind": "estructura",
      "last_seen": "2026-06-25T06:29:35.388844Z",
      "rel": "GERENTE",
      "s": "adys-lastre-morera",
      "sources": [],
      "status": "estructura",
      "t": "santa-lena-investment-lc"
    },
    {
      "confidence": 0.20000000298023224,
      "first_seen": "2026-06-25T06:29:35.316262Z",
      "kind": "estructura",
      "last_seen": "2026-06-25T06:29:35.316262Z",
      "rel": "GERENTE",
      "s": "adys-lastre-morera",
      "sources": [],
      "status": "estructura",
      "t": "remas-remas-investment-llc"
    },
    {
      "confidence": 0.550000011920929,
      "first_seen": "2026-06-24T19:29:44.816664Z",
      "kind": "estructura",
      "last_seen": "2026-06-25T06:29:35.267511Z",
      "rel": "VÍNCULO_FAMILIAR",
      "s": "adys-lastre-morera",
      "sources": [],
      "status": "estructura",
      "t": "ania-lastre-morera"
    },
    {
      "confidence": 0.20000000298023224,
      "first_seen": "2026-06-25T06:29:35.186552Z",
      "kind": "estructura",
      "last_seen": "2026-06-25T06:29:35.186552Z",
      "rel": "ARBITRO_FINAL_FUSION",
      "s": "min-economia-finanzas-planificacion",
      "sources": [],
      "status": "estructura",
      "t": "sociedades-mercantiles-mixtas"
    },
    {
      "confidence": 0.20000000298023224,
      "first_seen": "2026-06-25T06:29:35.115054Z",
      "kind": "estructura",
      "last_seen": "2026-06-25T06:29:35.115054Z",
      "rel": "APRUEBA_SMM",
      "s": "gaesa",
      "sources": [],
      "status": "estructura",
      "t": "sociedades-mercantiles-mixtas"
    },
    {
      "confidence": 0.20000000298023224,
      "first_seen": "2026-06-25T06:29:35.040202Z",
      "kind": "estructura",
      "last_seen": "2026-06-25T06:29:35.040202Z",
      "rel": "CREA_MARCO_LEGAL_PARA",
      "s": "min-economia-finanzas-planificacion",
      "sources": [],
      "status": "estructura",
      "t": "sociedades-mercantiles-mixtas"
    },
    {
      "confidence": 0.20000000298023224,
      "first_seen": "2026-06-25T06:29:34.957535Z",
      "kind": "estructura",
      "last_seen": "2026-06-25T06:29:34.957535Z",
      "rel": "COORDINA_ASIGNACION_CONCESIONES",
      "s": "min-comercio-inversion-extranjera",
      "sources": [],
      "status": "estructura",
      "t": "zed-mariel"
    },
    {